{
  "schema": "agora.magna.tokoin.release_manifest.v1",
  "status": "DRAFT_NOT_FROZEN",
  "network_key": "LOCAL_DEVNET",
  "chain_id": 31337,
  "maximum_authorized_network": "LOCAL_DEVNET",
  "deployment": {
    "classification": "LOCAL_DEVNET_TEST_ONLY_NO_ECONOMIC_VALUE",
    "contracts": {
      "TokoinFixedSupply": "0x940245084fc182c41e4c3f6e22095a9954ce1be0"
    },
    "offchain_trust_boundaries": [
      "GenesisTreasury",
      "RewardBudgetVault",
      "ChallengeEscrow",
      "RewardSplitter",
      "AgentPassportAnchor",
      "KnowledgeRootRegistry",
      "SettlementSaga",
      "WalletBinding"
    ],
    "deferred_not_in_release": ["PoolEscrow"]
  },
  "scope_matrix_hash": "3d39e01460d91363de487a1f0cb969398361d7338265d8996a97d0eb07924840",
  "ratification_bundle_hash": "d0eb54e06db6c1d402069b2760b511abd21d477cc909bd9359c8c0548845f15d",
  "source_manifest_hash": "fa213254937fc78d41c9dcb48062dc7764c70e808a752c1340ff0fad697af849",
  "external_independent_audit_complete": false,
  "public_testnet_deployed": false,
  "mainnet_transactions": 0,
  "real_value_moved": false
}
